### ISSUE TITLE
Instances aren't able to handle jumbo udp packets.

### ISSUE THREAD

**Issue by hasan4791** [rootless-containers/slirp4netns#306]
When running in podman rootless mode, its observed that the UDP size of the packet being generated from the slirp4netns is above 1500MTU and those jumbo frames aren't being handled either by the network or the destination instance. 

Packets with smaller sizes are working fine
```
16:46:50.098982 lo    In  IP fdcdafa3d2a2.51820 > fdcdafa3d2a2.36188: UDP, length 80
16:46:50.159104 lo    In  IP fdcdafa3d2a2.36188 > fdcdafa3d2a2.51820: UDP, length 80
```

Packets with larger size stuck one way
```
16:46:51.677731 lo    In  IP fdcdafa3d2a2.51820 > fdcdafa3d2a2.36188: UDP, length 2256
16:46:52.177416 lo    In  IP fdcdafa3d2a2.51820 > fdcdafa3d2a2.36188: UDP, length 4656
16:46:52.177443 lo    In  IP fdcdafa3d2a2.51820 > fdcdafa3d2a2.36188: UDP, length 4592
16:46:52.177468 lo    In  IP fdcdafa3d2a2.51820 > fdcdafa3d2a2.36188: UDP, length 4656
16:46:52.677117 lo    In  IP fdcdafa3d2a2.51820 > fdcdafa3d2a2.36188: UDP, length 4352
16:46:52.677142 lo    In  IP fdcdafa3d2a2.51820 > fdcdafa3d2a2.36188: UDP, length 2960
16:46:52.677174 lo    In  IP fdcdafa3d2a2.51820 > fdcdafa3d2a2.36188: UDP, length 4352
16:46:52.677232 lo    In  IP fdcdafa3d2a2.51820 > fdcdafa3d2a2.36188: UDP, length 3712
16:46:52.677238 lo    In  IP fdcdafa3d2a2.51820 > fdcdafa3d2a2.36188: UDP, length 4016
16:46:52.677242 lo    In  IP fdcdafa3d2a2.51820 > fdcdafa3d2a2.36188: UDP, length 3712
```

**Comment by hasan4791** [comment]
Had to update the MTU parameter in containers.conf file which resolved this issue. 👍🏽
